        <!ELEMENT students (student)*>
        <!ELEMENT student (name|age|info|message)*>
        <!ATTLIST student
                id CDATA #REQUIRED>
        <!ELEMENT name (#PCDATA)>
        <!ELEMENT age (#PCDATA)>
        <!ELEMENT info (#PCDATA)>
        <!ELEMENT message (#PCDATA)>
