<?xml version="1.0" encoding="utf-8" ?>
<!DOCTYPE students SYSTEM 'student.dtd'>
<students>
    <student id="1">
        <name>alice</name>
        <age>22</age>
        <info>学生&lt;&gt;的信息</info>
        <message><![CDATA[
        <<<<内容>>>>]
        ]]></message>
    </student>
    <student id="2">
        <name>tom</name>
        <age>21</age>
    </student>
</students>